{
  "schema_version": "2.0",
  "job_id": "job-draft01",
  "trace_id": "trace-draft-0001",
  "job_type": "DRAFT",
  "status": "SUCCEEDED",
  "execution": {
    "created_at": "2026-09-20T10:00:00.000Z",
    "started_at": "2026-09-20T10:00:03.000Z",
    "finished_at": "2026-09-20T10:03:41.000Z",
    "attempt": 1
  },
  "input": {
    "repository": {
      "url": "https://github.com/241880199/DevOps",
      "commit": "d47a1523beec3311033eabf2e74c2a6ac299720d"
    },
    "build": {
      "command": "make",
      "verify_command": "./hello",
      "verify_expect": "hello E3",
      "project_subdir": "fixtures/draft"
    },
    "limits": {
      "max_iterations": 5,
      "timeout_seconds": 600
    },
    "context_documents": ["README.md"]
  },
  "output": {
    "environment_id": "env-draft-fixture-mode0",
    "dockerfile_artifact_id": "dockerfile-001",
    "image_artifact_id": "image-ref-001",
    "resolved_commit": "d47a1523beec3311033eabf2e74c2a6ac299720d",
    "iterations": [
      {
        "round": 0,
        "action": "INITIAL",
        "reason": "依据 context_documents 中的 README.md 推断构建命令为 make，选用 ubuntu:22.04 作为基础镜像并显式安装 build-essential。",
        "outcome": "BUILD_OK",
        "build_log_artifact_id": "buildlog-0001"
      },
      {
        "round": 1,
        "action": "PATCH",
        "reason": "首轮构建虽通过，但镜像内残留 apt 缓存；补 --no-install-recommends 并清理 /var/lib/apt/lists。",
        "error_excerpt": "",
        "outcome": "BUILD_OK",
        "build_log_artifact_id": "buildlog-0002"
      },
      {
        "round": 2,
        "action": "OPTIMIZE",
        "reason": "改用多阶段构建，将最终镜像体积从 412MB 降至 78MB。",
        "outcome": "VERIFY_OK",
        "build_log_artifact_id": "buildlog-0003"
      }
    ],
    "result": {
      "build_ok": true,
      "artifact_present": true,
      "verify_ok": true,
      "verify_stdout": "hello E3\n",
      "rounds_used": 2
    }
  }
}
