{
  "schema_version": "2.0",
  "job_id": "job-draft04",
  "trace_id": "trace-draft-0004",
  "job_type": "DRAFT",
  "status": "TIMED_OUT",
  "execution": {
    "created_at": "2026-09-20T10:20:00.000Z",
    "started_at": "2026-09-20T10:20:01.000Z",
    "finished_at": "2026-09-20T10:30:13.000Z",
    "attempt": 1
  },
  "input": {
    "repository": {
      "url": "https://github.com/241880199/DevOps",
      "commit": "d47a1523beec3311033eabf2e74c2a6ac299720d"
    },
    "build": {
      "command": "make",
      "verify_command": "./hello",
      "verify_expect": "hello E3",
      "project_subdir": "fixtures/draft"
    },
    "runtime_capabilities": ["ptrace"],
    "limits": {
      "max_iterations": 5,
      "timeout_seconds": 600
    },
    "context_documents": ["README.md"]
  },
  "error": {
    "code": "EXEC_4002",
    "stage": "EXEC",
    "message": "任务超时：单次构建超出预算，任务被终止。",
    "detail": "limits.timeout_seconds=600，第 3 轮构建累计 612s 未结束。已产出的中间日志见 artifact buildlog-0021。",
    "at": "2026-09-20T10:30:13.000Z"
  }
}
